{
  "$schema": "https://json-schema.org/draft/2020-12/schema",
  "$id": "urn:ai-platform:contract:api:problem-details:1.0",
  "title": "Problem Details",
  "description": "RFC 9457 Problem Details error body, extended with a stable error_code and correlation_id, per ADR-0004 Section 9.",
  "type": "object",
  "additionalProperties": false,
  "properties": {
    "type": {
      "type": "string",
      "format": "uri",
      "description": "Stable problem-type URI or URN."
    },
    "title": {
      "type": "string",
      "minLength": 1,
      "maxLength": 200,
      "description": "Short, stable, safe human summary. Clients must not branch on this text."
    },
    "status": {
      "type": "integer",
      "minimum": 400,
      "maximum": 599,
      "description": "HTTP status repeated as an integer."
    },
    "detail": {
      "type": "string",
      "minLength": 1,
      "maxLength": 500,
      "description": "Safe occurrence-specific explanation. Clients must not branch on this text."
    },
    "error_code": {
      "type": "string",
      "pattern": "^[A-Z][A-Z0-9_]*$",
      "description": "Stable machine-readable UPPER_SNAKE_CASE extension. Clients make decisions from this field."
    },
    "correlation_id": {
      "type": "string",
      "pattern": "^[0-9a-f]{8}-[0-9a-f]{4}-7[0-9a-f]{3}-[89ab][0-9a-f]{3}-[0-9a-f]{12}$",
      "description": "Lowercase UUIDv7 for support and trace correlation. Always the current invocation's effective value (see ADR-0012)."
    },
    "details": {
      "type": "array",
      "maxItems": 20,
      "description": "Bounded array of documented validation-detail objects.",
      "items": {
        "type": "object",
        "additionalProperties": false,
        "required": ["code", "path", "message"],
        "properties": {
          "code": {
            "type": "string",
            "pattern": "^[A-Z][A-Z0-9_]*$"
          },
          "path": {
            "type": "string",
            "maxLength": 200,
            "description": "JSON Pointer path to the offending field."
          },
          "message": {
            "type": "string",
            "maxLength": 300
          }
        }
      }
    }
  },
  "required": ["type", "title", "status", "detail", "error_code", "correlation_id"]
}
