{
  "type": "urn:ai-platform:problem:request-id-conflict",
  "title": "Request ID Conflict",
  "status": 409,
  "detail": "The supplied request_id is already mapped to a different accepted request.",
  "error_code": "REQUEST_ID_CONFLICT",
  "correlation_id": "019fbdd6-ab3d-77aa-8e61-4c3d5eb12988"
}
